{
  "contract_version": "msce-memory-contract-v1",
  "event_id": "msce-event-004",
  "timestamp": "2026-07-08T22:30:00Z",
  "source_system": "workrunner",
  "generated_by": "msce",
  "project": "liongateos-memory",
  "task_id": "task-004",
  "task_type": "architecture",
  "lifecycle_state": "completed",
  "summary": "Architecture decision was identified during lifecycle interpretation.",
  "confidence": 0.96,
  "decisions_detected": [
    "Use an independent MSCE-Contract repository as the interface boundary."
  ],
  "outcomes_detected": [
    "System ownership boundaries were finalized."
  ],
  "blockers_detected": [],
  "validation_results": [
    "Architecture review completed."
  ],
  "evidence": [
    "MSCE interpretation output"
  ],
  "related_events": [
    "workrunner-event-004"
  ],
  "continuity_signals": [
    "architecture_decision"
  ],
  "provenance": {
    "originating_system": "workrunner",
    "source_event_references": [
      "workrunner-event-004"
    ],
    "interpretation_version": "msce-v1"
  }
}
