{
  "contract_version": "msce-memory-contract-v1",
  "event_id": "msce-event-001",
  "timestamp": "2026-07-08T21:00:00Z",
  "source_system": "workrunner",
  "generated_by": "msce",
  "project": "liongateos-memory",
  "task_id": "task-001",
  "task_type": "validation",
  "lifecycle_state": "completed",
  "summary": "Validated MSCE to Memory contract architecture checkpoint.",
  "confidence": 0.95,
  "decisions_detected": [
    "Use shared MSCE contract boundary."
  ],
  "outcomes_detected": [
    "Architecture ownership finalized."
  ],
  "blockers_detected": [],
  "validation_results": [
    "Architecture review completed."
  ],
  "evidence": [
    "MSCE lifecycle interpretation output"
  ],
  "related_events": [
    "workrunner-event-001"
  ],
  "continuity_signals": [
    "architecture_decision"
  ],
  "provenance": {
    "originating_system": "workrunner",
    "source_event_references": [
      "workrunner-event-001"
    ],
    "interpretation_version": "msce-v1"
  }
}
